{
 "schemaVersion": 1,
 "domain": "culture-sheet",
 "_": "Settlement sheet for the Lighter Flotilla (lane 2.5c).",
 "entries": [
  {
   "id": "culture.settlement.lighter-flotilla",
   "level": "settlement",
   "name": "The Lighter Flotilla",
   "parent": "culture.region.mercantile-coast",
   "placeId": "place.mercantile-coast.lighter-flotilla",
   "norms": [
    {
     "text": "A hull casts off only on the speaker's nod.",
     "source": "inferred"
    },
    {
     "text": "Crews live aboard the hulls they work.",
     "source": "inferred"
    }
   ],
   "taboos": [
    {
     "text": "Taking a cargo off the anchorage outside the crew's turn.",
     "source": "inferred"
    },
    {
     "text": "Calling a stoppage without a vote.",
     "source": "inferred"
    }
   ],
   "values": [
    {
     "text": "The link between the deep-water hulls and the city.",
     "source": "inferred"
    },
    {
     "text": "Moorings that have not shifted in years.",
     "source": "inferred"
    }
   ],
   "contempts": [
    {
     "text": "Council men who write licences for work they never did.",
     "source": "inferred"
    },
    {
     "text": "Captains who try to beach their own boats at the quay.",
     "source": "inferred"
    }
   ],
   "opinions": {
    "place": {
     "lean": 1,
     "text": "Four hulls moored as houses along one pier, out of the tariff line.",
     "source": "inferred"
    },
    "work": {
     "lean": 1,
     "text": "Every cargo in the bay comes ashore in a lighter's hold.",
     "source": "world/sources/lore/lilmoth.md"
    },
    "people": {
     "lean": 1,
     "text": "The crews hold together because the city needs all of them at once.",
     "source": "inferred"
    },
    "faction": {
     "lean": 0,
     "text": "Compact members hold the posts; some workers here owe the guild no share.",
     "source": "inferred"
    },
    "trade": {
     "lean": 1,
     "text": "The market rafts sell what the tariff line never sees.",
     "source": "inferred"
    },
    "danger": {
     "lean": 0,
     "text": "Slaughterfish and gar work the water under the hulls.",
     "source": "inferred"
    },
    "directions": {
     "lean": 1,
     "text": "The landing stage runs to the Lilmoth track; boats run to the anchorage and to Archon.",
     "source": "inferred"
    }
   },
   "speech": {
    "addressTerms": [
     {
      "text": "Shore-foot, for anyone who came down the landing stage.",
      "source": "inferred"
     }
    ],
    "formality": "low",
    "oaths": [
     {
      "text": "Fair water.",
      "source": "inferred"
     }
    ],
    "neverSaid": [
     {
      "text": "How much the crews lost in the stoppage.",
      "source": "inferred"
     }
    ],
    "registerRef": "docs/standards/text/culture-registers.md#4-faction--class-layer--the-words-an-institution-issues"
   },
   "talk": {
    "grievances": [
     {
      "text": "The council tried to license lightering once; the crews stopped the port for two weeks.",
      "source": "inferred"
     }
    ],
    "rumours": [
     {
      "text": "A council member talks of dredging a deep channel.",
      "source": "inferred"
     }
    ]
   },
   "views": [
    {
     "node": "culture.faction.reed-sail-compact",
     "lean": 1,
     "text": "The guild that holds the speaker's post and the right to stop the port.",
     "source": "inferred"
    }
   ],
   "deviationRate": 0.3,
   "dissent": [
    {
     "personId": "npc.mercantile-coast.lighter-flotilla.n1-4",
     "topic": "faction",
     "lean": -1,
     "text": "Spends his share on the jaw beetle fights at Archon, not the Compact's dues (record lines).",
     "source": "inferred"
    },
    {
     "personId": "npc.mercantile-coast.lighter-flotilla.n2",
     "topic": "faction",
     "lean": -1,
     "text": "No guild: mends for whoever brings a net; pays no share (record life block).",
     "source": "inferred"
    }
   ]
  }
 ]
}
