{
 "schemaVersion": 1,
 "domain": "culture-sheet",
 "_": "Faction and office sheets for The Imperial Legion remnant (lane 2.5a2). Ranks: the registry ladder (associate, member, senior); named offices beyond it are listed by their own rank slug.",
 "entries": [
  {
   "id": "culture.faction.imperial-legion-remnant",
   "level": "faction",
   "name": "The Imperial Legion remnant",
   "parent": "culture.province.black-marsh",
   "factionId": "faction.imperial-legion-remnant",
   "norms": [
    {
     "text": "Garrisons left behind keep the rolls and the drill.",
     "source": "world/sources/lore/extrapolation/argonia-4e201-state.md"
    },
    {
     "text": "No pay from Cyrodiil for generations.",
     "source": "world/sources/lore/extrapolation/argonia-4e201-state.md"
    }
   ],
   "taboos": [
    {
     "text": "Striking the colours.",
     "source": "inferred"
    }
   ],
   "values": [
    {
     "text": "Duty, honour, plainly.",
     "source": "inferred"
    }
   ],
   "contempts": [
    {
     "text": "The Wardens who let them rot.",
     "source": "world/sources/lore/extrapolation/argonia-4e201-state.md"
    }
   ],
   "opinions": {
    "empire": {
     "lean": 2,
     "text": "The Legion is the Empire here.",
     "source": "world/sources/lore/extrapolation/argonia-4e201-state.md"
    },
    "faction": {
     "lean": -1,
     "text": "The Wardens tolerate us.",
     "source": "world/sources/lore/extrapolation/argonia-4e201-state.md"
    },
    "danger": {
     "lean": -1,
     "text": "The Blackwood road.",
     "source": "world/sources/lore/extrapolation/argonia-4e201-state.md"
    }
   },
   "speech": {
    "addressTerms": [
     {
      "text": "Citizen.",
      "source": "inferred"
     },
     {
      "text": "Serjeant, decurion.",
      "source": "inferred"
     }
    ],
    "formality": "formal",
    "oaths": [
     {
      "text": "By the Eagle.",
      "source": "inferred"
     }
    ],
    "neverSaid": [
     {
      "text": "That Cyrodiil forgot.",
      "source": "world/sources/lore/extrapolation/argonia-4e201-state.md"
     }
    ],
    "registerRef": "docs/standards/text/culture-registers.md#4-faction--class-layer--the-words-an-institution-issues"
   },
   "talk": {
    "grievances": [
     {
      "text": "Unpaid since before living memory.",
      "source": "world/sources/lore/extrapolation/argonia-4e201-state.md"
     }
    ],
    "rumours": [
     {
      "text": "A courier on the Leyawiin road.",
      "source": "inferred"
     }
    ]
   },
   "views": [
    {
     "node": "culture.faction.an-xileel",
     "lean": -1,
     "text": "Landlords.",
     "source": "world/sources/lore/extrapolation/argonia-4e201-state.md"
    },
    {
     "node": "culture.faction.morrowind-veterans",
     "lean": -1,
     "text": "The other left-behinds.",
     "source": "inferred"
    }
   ],
   "deviationRate": 0.15
  },
  {
   "id": "culture.office.imperial-legion-remnant.senior",
   "level": "office",
   "name": "Legion serjeant on watch",
   "parent": "culture.faction.imperial-legion-remnant",
   "factionId": "faction.imperial-legion-remnant",
   "rank": "senior",
   "norms": [
    {
     "text": "Four-word barks; orders as regulation numbers.",
     "source": "inferred"
    }
   ],
   "taboos": [
    {
     "text": "Slack watch.",
     "source": "inferred"
    }
   ],
   "values": [
    {
     "text": "The post.",
     "source": "inferred"
    }
   ],
   "contempts": [
    {
     "text": "Slackers.",
     "source": "inferred"
    }
   ],
   "opinions": {
    "danger": {
     "lean": -1,
     "text": "The road.",
     "source": "world/sources/lore/extrapolation/argonia-4e201-state.md"
    }
   },
   "speech": {
    "addressTerms": [
     {
      "text": "Citizen.",
      "source": "inferred"
     }
    ],
    "formality": "formal",
    "oaths": [
     {
      "text": "By the Eagle.",
      "source": "inferred"
     }
    ],
    "neverSaid": [
     {
      "text": "No relief.",
      "source": "inferred"
     }
    ],
    "registerRef": "docs/standards/text/culture-registers.md#4-faction--class-layer--the-words-an-institution-issues"
   },
   "talk": {
    "grievances": [
     {
      "text": "No pay.",
      "source": "world/sources/lore/extrapolation/argonia-4e201-state.md"
     }
    ],
    "rumours": [
     {
      "text": "Raiders near.",
      "source": "inferred"
     }
    ]
   },
   "views": [
    {
     "node": "culture.faction.imperial-legion-remnant",
     "lean": 2,
     "text": "Theirs.",
     "source": "inferred"
    }
   ],
   "deviationRate": 0.1
  },
  {
   "id": "culture.office.imperial-legion-remnant.penal-warden",
   "level": "office",
   "name": "Rose penal warden (inherited Imperial office)",
   "parent": "culture.faction.imperial-legion-remnant",
   "factionId": "faction.imperial-legion-remnant",
   "rank": "penal-warden",
   "norms": [
    {
     "text": "Procedure recited flatly, including when monstrous.",
     "source": "world/sources/lore/topics/prisons.md"
    },
    {
     "text": "The Imperial numbering is kept.",
     "source": "world/sources/lore/topics/prisons.md"
    }
   ],
   "taboos": [
    {
     "text": "Opening the bricked levels.",
     "source": "world/sources/lore/topics/prisons.md"
    }
   ],
   "values": [
    {
     "text": "The register.",
     "source": "world/sources/lore/topics/prisons.md"
    }
   ],
   "contempts": [
    {
     "text": "Escapes.",
     "source": "world/sources/lore/topics/prisons.md"
    }
   ],
   "opinions": {
    "work": {
     "lean": 0,
     "text": "Sentences are balances.",
     "source": "world/sources/lore/topics/labour-and-bondage.md"
    },
    "danger": {
     "lean": -1,
     "text": "The lower levels.",
     "source": "world/sources/lore/topics/prisons.md"
    }
   },
   "speech": {
    "addressTerms": [
     {
      "text": "Inmate, resident, by status.",
      "source": "world/sources/lore/topics/prisons.md"
     }
    ],
    "formality": "formal",
    "oaths": [
     {
      "text": "Per the register.",
      "source": "world/sources/lore/topics/prisons.md"
     }
    ],
    "neverSaid": [
     {
      "text": "What is below.",
      "source": "world/sources/lore/topics/prisons.md"
     }
    ],
    "registerRef": "docs/standards/text/culture-registers.md#4-faction--class-layer--the-words-an-institution-issues"
   },
   "talk": {
    "grievances": [
     {
      "text": "The ledger is three generations deep.",
      "source": "world/sources/lore/topics/labour-and-bondage.md"
     }
    ],
    "rumours": [
     {
      "text": "A cell opened itself.",
      "source": "world/sources/lore/topics/prisons.md"
     }
    ]
   },
   "views": [
    {
     "node": "culture.faction.chainbreakers",
     "lean": -1,
     "text": "Agitators.",
     "source": "world/sources/lore/topics/labour-and-bondage.md"
    }
   ],
   "deviationRate": 0.1
  }
 ]
}
