{
 "schemaVersion": 1,
 "domain": "culture-sheet",
 "_": "Faction and office sheets for The Salt-Teeth (lane 2.5a2). Ranks: the registry ladder (associate, member, senior); named offices beyond it are listed by their own rank slug.",
 "entries": [
  {
   "id": "culture.faction.salt-teeth",
   "level": "faction",
   "name": "The Salt-Teeth",
   "parent": "culture.province.black-marsh",
   "factionId": "faction.salt-teeth",
   "norms": [
    {
     "text": "The shortest thing that can be shouted across water.",
     "source": "inferred"
    },
    {
     "text": "Shares by the old count.",
     "source": "inferred"
    }
   ],
   "taboos": [
    {
     "text": "Naming who is ashore.",
     "source": "inferred"
    }
   ],
   "values": [
    {
     "text": "The hull and the share.",
     "source": "inferred"
    }
   ],
   "contempts": [
    {
     "text": "Charter captains.",
     "source": "inferred"
    }
   ],
   "opinions": {
    "trade": {
     "lean": 1,
     "text": "Cargo is whatever comes past.",
     "source": "inferred"
    },
    "danger": {
     "lean": 0,
     "text": "The Charter hunts us; the sea does worse.",
     "source": "inferred"
    },
    "faction": {
     "lean": -1,
     "text": "The Compact takes its cut and pretends not to know us.",
     "source": "inferred"
    }
   },
   "speech": {
    "addressTerms": [
     {
      "text": "Mate; nobody.",
      "source": "inferred"
     }
    ],
    "formality": "low",
    "oaths": [
     {
      "text": "Teeth out.",
      "source": "inferred"
     }
    ],
    "neverSaid": [
     {
      "text": "The anchorage.",
      "source": "inferred"
     }
    ],
    "registerRef": "docs/standards/text/culture-registers.md#4-faction--class-layer--the-words-an-institution-issues"
   },
   "talk": {
    "grievances": [
     {
      "text": "The Charter is paid to hunt us.",
      "source": "inferred"
     }
    ],
    "rumours": [
     {
      "text": "A fat Khajiit hull is due off Quinrawl.",
      "source": "inferred"
     }
    ]
   },
   "views": [
    {
     "node": "culture.faction.marsh-charter",
     "lean": -1,
     "text": "Hunters.",
     "source": "inferred"
    },
    {
     "node": "culture.faction.reed-sail-compact",
     "lean": 1,
     "text": "Family, embarrassed.",
     "source": "inferred"
    }
   ],
   "deviationRate": 0.2
  },
  {
   "id": "culture.office.salt-teeth.senior",
   "level": "office",
   "name": "Shore captain",
   "parent": "culture.faction.salt-teeth",
   "factionId": "faction.salt-teeth",
   "rank": "senior",
   "norms": [
    {
     "text": "Orders in two words.",
     "source": "inferred"
    }
   ],
   "taboos": [
    {
     "text": "Talking ashore.",
     "source": "inferred"
    }
   ],
   "values": [
    {
     "text": "The share.",
     "source": "inferred"
    }
   ],
   "contempts": [
    {
     "text": "Talkers.",
     "source": "inferred"
    }
   ],
   "opinions": {
    "trade": {
     "lean": 1,
     "text": "Shares.",
     "source": "inferred"
    }
   },
   "speech": {
    "addressTerms": [
     {
      "text": "Mate.",
      "source": "inferred"
     }
    ],
    "formality": "low",
    "oaths": [
     {
      "text": "Teeth out.",
      "source": "inferred"
     }
    ],
    "neverSaid": [
     {
      "text": "The next hull.",
      "source": "inferred"
     }
    ],
    "registerRef": "docs/standards/text/culture-registers.md#4-faction--class-layer--the-words-an-institution-issues"
   },
   "talk": {
    "grievances": [
     {
      "text": "Too few hands.",
      "source": "inferred"
     }
    ],
    "rumours": [
     {
      "text": "A Charter boat off the point.",
      "source": "inferred"
     }
    ]
   },
   "views": [
    {
     "node": "culture.faction.salt-teeth",
     "lean": 2,
     "text": "Theirs.",
     "source": "inferred"
    }
   ],
   "deviationRate": 0.1
  }
 ]
}
